Codigo_Producto_SKU,Nombre,Descripcion_Producto,Stock,Categoria,Imagen(url del servidor)
"1355,Grifo para Manguera Exterior 3/4"",Grifo de pared para conexión de manguera.,110,fontaneria,https://server.com/img/grifo_355.jpg"
1356,Soldadura MIG sin Gas 1kg,Carrete de alambre fundente para soldadora MIG.,30,SOLDADURA,https://server.com/img/mig_356.jpg
INV-1357,Kit de Primeros Auxilios para Vehículos,Botiquín compacto para carros.,85,SEGURIDAD,https://server.com/img/botiquin_357.jpg
SKU-1358,Set de Llaves Combinadas Mando Fijo,Juego de llaves mixtas sin matraca.,90,Manuales,https://server.com/img/llaves_358.jpg
1359,Pasta Lija para Carrocería Fina,Pasta de pulido para acabados de pintura.,100,consumibles,https://server.com/img/pasta_359.jpg
1360,Tornillos T-25 para Estructuras Madera,Tornillos grandes para construcción de terrazas.,70,fijaciones,https://server.com/img/tornillo_360.jpg
1361,Adhesivo de Poliuretano para Vidrio,Sellador elástico para parabrisas y vidrios.,140,QUÍMICOS,https://server.com/img/poliuretano_361.jpg
4533J,Pintura Vinílica Exterior 1 Galón,Pintura resistente al clima. Acabado semibrillo.,18,Pinturas,https://server.com/img/pintura_362.jpg
1363,Interruptor de Seguridad Industrial,Interruptor de corte de corriente de alta capacidad.,25,ELECTRICIDAD,https://server.com/img/interruptor_363.jpg
NULL,Motosierra a Batería 40V,Motosierra potente sin cables.,8,Jardinería,https://server.com/img/motosierra_364.jpg
1365,Caja de Herramientas Plástica Grande Ruedas,Caja con asa telescópica y ruedas para transporte.,15,Herramientas,https://server.com/img/caja_365.jpg
1366,Guantes de Trabajo Antivibración,Guantes para el uso de herramientas de impacto.,50,SEGURIDAD,https://server.com/img/guantes_366.jpg
INV-1367,Luminaria LED Hermética para Exterior,Foco sellado resistente al agua y polvo.,45,ILUMINACION,NULL
"SKU_1368,Tubo de Polietileno Alta Densidad 1"",Tubería negra para agua potable.,100,FONTANERIA,https://server.com/img/tubo_368.jpg"
1369,Set de Pinzas de Electrónica 4pcs,Pinzas de punta fina y corte para circuitos.,85,Manuales,https://server.com/img/pinzas_369.jpg
1370,Pintura Spray Alta Temperatura Negro,Aerosol resistente al calor para parrillas y motores.,150,pintura,https://server.com/img/spray_370.jpg
1371-D,Cinta Adhesiva de Aluminio,Cinta para sellar conductos de aire (HVAC).,120,Consumibles,https://server.com/img/cinta_371.jpg
4533K,Pintura Base Agua Mate 1 Galón,Pintura con aditivo antihongos.,NULL,PINTURA,https://server.com/img/pintura_372.jpg
1373,Brocas para Router de Moldura,Fresa para router para crear bordes decorativos.,30,Brocas,https://server.com/img/brocas_373.jpg
NULL,Pasta para Soldar Cobre y Plata,Fundente de alta actividad para tuberías.,70,SOLDADURA,https://server.com/img/pasta_374.jpg
1375,Cerradura Invisible Remota,Cerradura electrónica sin bocallave visible.,10,HERRAJES,https://server.com/img/cerradura_375.jpg
1376,Termostato Digital WiFi Programable,Termostato inteligente para calefacción/AC.,20,ELECTRICIDAD,https://server.com/img/termostato_376.jpg
INV-1377,Llave de T para Bujías 13mm,Llave de mango deslizante para bujías de motor.,60,HERRAMIENTAS MANUALES,https://server.com/img/llave_377.jpg
SKU-1378,Tornillos de Cabeza Redonda con Cuadrado,Tornillos coche para madera y metal.,150,fijaciones,https://server.com/img/tornillo_378.jpg
1379,Manguera de Riego por Goteo 100m,Tubería con emisores integrados.,15,JARDINERÍA,https://server.com/img/goteo_379.jpg
1380,Medidor de CO2 Digital Portátil,Instrumento para medir la calidad del aire interior.,25,Herramientas,https://server.com/img/co2_380.jpg
"1381,Lijadora de Banda de Mano 3x18"",Lijadora portátil para superficies planas.,10,HERRAMIENTAS,https://server.com/img/lijadora_381.jpg"
4533L,Pintura Impermeabilizante Elástica,Recubrimiento para muros exteriores.,12,Pinturas,https://server.com/img/impermeab_382.jpg
1383,Grifo de Cuello de Cisne para Cocina,Grifería alta con caño curvo.,18,FONTANERIA,https://server.com/img/grifo_383.jpg
NULL,Masilla para Juntas de Drywall,Compuesto de relleno para placas de yeso.,90,Consumibles,https://server.com/img/masilla_384.jpg
1385,Soplete de Gas Propano con Encendido,Antorcha para soldadura blanda y calentamiento.,45,SOLDADURA,https://server.com/img/soplete_385.jpg
1386,Set de Tarugos y Tornillos de Plástico,Anclajes para pared de ladrillo y concreto.,300,Fijaciones,https://server.com/img/tarugos_386.jpg
INV-1387,Guantes de Nitrilo Desechables 100pcs,Guantes sin polvo para químicos y limpieza.,200,seguridad,https://server.com/img/guantes_387.jpg
SKU_1388,Lámpara UV para Detección de Fugas,Linterna de luz negra para refrigerantes y aceites.,60,ILUMINACION,https://server.com/img/uv_388.jpg
1389,Bomba de Aire Eléctrica para Inflables,Bomba de bajo volumen y alta presión.,75,Herramientas,https://server.com/img/bomba_389.jpg
1390,Set de Lima Rotativa para Metal,Fresas de carburo de tungsteno para taladro.,40,Brocas,https://server.com/img/lima_390.jpg
1391-E,Adhesivo de Silicona Acética Negra,Sellador multiuso para baños y cocinas. Color negro.,120,QUÍMICOS,https://server.com/img/silicona_391.jpg
4533M,Pintura Base Agua Mate 1 Galón,Pintura con resistencia a la humedad.,NULL,Pintura,https://server.com/img/pintura_392.jpg
1393,Cerradura Electrónica con Teclado,Cerradura de puerta con código digital.,22,Herrajes,https://server.com/img/teclado_393.jpg
NULL,Cable de Red RJ45 15 Metros,Cable UTP Cat 6 pre-ensamblado.,100,ELECTRICIDAD,https://server.com/img/cable_394.jpg
1395,Mochila para Notebook y Herramientas,Mochila con compartimento acolchado para laptop.,18,SEGURIDAD,https://server.com/img/mochila_395.jpg
1396,Sierra de Mesa para Cerámica Húmeda,Cortadora de azulejos con bandeja de agua.,3,HERRAMIENTAS,https://server.com/img/sierra_396.jpg
"INV-1397,Pinzas de Presión Mordaza Curva 10"",Pinzas de sujeción ajustables.,80,Manuales,https://server.com/img/pinzas_397.jpg"
SKU-1398,Tubo de Abasto Flexible para WC,Manguera de conexión para inodoro.,150,FONTANERIA,https://server.com/img/abasto_398.jpg
1399,Regadera para Jardín con Mango Largo,Regadera de plástico de 10 litros.,90,jardinería,https://server.com/img/regadera_399.jpg
1400-K,Pintura Spray Acrílica Transparente Brillante,Aerosol de acabado protector.,200,Pinturas,https://server.com/img/spray_400.jpg